review,rating
proszendesk makes closing work orders easy and organized it allows you and your team to be more effective and efficient with the work orders that you have before you,5
it just works,5
es una aplicación sólida de servicio al cliente con características útiles y herramientas de automatización que permite a empresas gestionar las interacciones con sus clientes,4
i highly recommend especially on a teamwork ict environments,5
prosthe ticketing system and article database has been the most helpful in managing our tech support needs,5
very good easy to use even for small businesses,4
great app for teams that deal with a lot of customer issues and from different sources chats calls emails etc,5
i have used this software for just over a year now i have no idea how we even managed with zendesk at this time it helps us intergrate every tool we use and is the central place of work,5
prosit has a lot of features and has been around for ages,4
zendesk is easy to use straightforward and efficient,5
customer service general website questions real time help,5
it has made our support much easier and faster,4
overall its a value add in sales and marketing team to respond to queries realtime,4
i love this application ive tried other apps and they do not beat zendesk at all not even close,5
proszendesk just works it has so many customization options to let it do exactly what yo need it to do,5
zendesk chat made my job so easy and smooth i love how all my extensions worked with it grammarly text expander and it was helpful regarding alerting you on time and when the customer reads the chat and when they are typing,5
prosla traçabilité des demandes clientsla programmation des réponsesle fait de pouvoir répondre aux clients par plusieurs canaux,3
we can quickly and accurately resolve tickets because the software is simple to use this assists us in resolving several tickets each day,5
proswe use this software for technical support questions chat and overall support to our customers it is very convenient i even use the app,5
prosi love that you are able to track leads and also integrate docusign and hubspot makes it easier for folks who are traveling and needing to submit proposals from events,4
prosi love the uiits structured in a simplistic fashion that makes training new agents super easy because it just makes sense,5
proso produto retorna praticidade e controle às demandas de help desk,5
zendesk has made issue resolution possible across a broad company,4
prosits very simple and straight forward from an enduser perspective theres really no learning curve if youre used to general ticketing software,5
i use it daily and it makes all the communications very easy and fluent,5
overall zendesk is a great software for managing multiple channels like calling chatting and email all from the same place,4
prosgreat product for resolving different issues with customers tickets are received and sorted by categories so operators can provide further assistance you can use the ticket system or online chat system canned messages that are created helps for faster response tickets can be sorted by pending unsolved resolved and other everything is visible and userfriendly,5
proses ist sehr einfach zu bedienen und macht den kundensupport sehr einfach ein kunde zwei mitarbeiter kein problem läuft reibungslos,5
prosmostly every website i go to uses zendesk its very good at staying in contact with customers or when its you that needs help with something this is who i always see,5
prosstunningly beautiful interface strong features and connectivity with apps support via integrated phone and chat very good knowledge base,4
very easy to use way better than trying to handle this with gmail,5
easy and effective customer support,5
i have used zendesk for over years it has always worked flawlessly and has always been a perfect solution to my customer support platform needs they have an excellent team and are always more than helpful regarding and situation that has arisen,5
i didnt have a lot of problems with it is very very easy to navigate,5
efficient ticket solving and note taking,4
the benefit of communicating effectively with my companys audience,5
prosthis roo was a great addition to our company we used it to track customers issues and it allowed us to manage customer satisfaction,5
it was an amazing app as it was my first itsm app and it was more easier to use understand and flow with,4
the overall experience was good and provides excellent features they can probably work on providing priority support to firsttime users,5
prosi like that you can sort things by their specifics depending on what the report is about and that you can make public and private comments,3
prosmakes communicating with internal teams and external teams organized plus automates some workload they have a great support team as well,4
proswhat we liked the most is the capability to create agents and centralize all the social media and other applications like whatsapp communication via zend desk we have one place in which we manage all the communication efficiently,4
proseasy to use and onboard new agents integrates well with our systems,5
prosi love that it is an efficient helpdesk system very easy to use respond to queries and monitor progress of complaints running a small business means you are in a critical stage of building your customer pool and making sure that you provide excellent customer support thats what zendesk is all about making sure that youre on track and nothing falls through the cracks,4
já uso a muitos anos é robusto e,4
we used it as a general help desk tool and shared services ticketing tool,3
it was good im thankful for what i learned from it because it makes the training easier and when we change the system it wasnt like a leap of faith but we had knowledge from zendesk and that help me a lot,5
our experience has been great very little issues with software or integrations,5
prosi like how it makes it really easy to keep track of my tickets as well prioritizeescalate the really important ones,5
prosallows customers to manage their tickets by email or web interfaceflexible for allowing various queues categories tagging etc for better customer routingescalation and data analysis,4
overall experience using zendesk suite is positive as its integration customizable solutions powerful reporting capabilities are very helpful to streamlined customer support process,5
prosas a virtual assistant im in charge of customer management for my company it enables me to manage customers by livechat email and voice,5
zendesk helps us to solve problems of clients through ticketing and social media while they contact us,5
this has worked pretty well for both support and our help center there are shortcomings when it comes to communication through the widget and they got rid of the proactive outreach tool and these may lead us to choose another solution down the road,4
proswe can talk to customers on any omni channel and they are kept in one place this allows us to have the best customer experience possible being an admin of the tool is super easy as well the analytics offered makes strategic decision making easy to do also having zendesk live chat availavle is super helpful,5
prosit is easy to answer questions that stores ask our corporate headquarters and easy to pass on to another team if i am unable to answer,5
it helps us stay in touch with our customers,5
we love zendesk and appreciate the solutions that they have solved for our company,5
control for customer service tasks,4
prosvery user friendly very organized easy to search and has a great look to iteverything is sleek and well organized,5
really complete customer success product allows for chat email and phone support would recommend to all software companies,4
great experience again super easy to use holds all client contact info and great for internal communication as well,5
proszendesk helped us in managing escalations via chat and due to multiple integration option it was quite easy to manage all of the tickets,5
overall i felt like zendesk made my job easier when i was doing call center work,4
minus the price zendesk has been awesome it has all the features that you could want and its also very easy to customize and extend the product our team enjoys working within it compared to some other tools and they are definitely an industryleader in the area,5
prosthe system is easy to use and get up and running zendesk support is really out of this world quick and very helpful the ticketing system does everything we needed and more it allowed us to expand our support system because of the added features,5
proswe are able to customize zendesk to meet all of our support needswe use it for email and phone and manage our workflows through it,4
prosi love that the tool is easy to deploy use and train for new users,5
overall this software has made our customer support experience for our custom software solutions much easier than previous solutions we have integrated for the time it saves and the reliability of the service this software becomes well worth the money spent,5
we use it for managing live chat interactions and raise tickets for follow up,5
proswe use zendesk on a daily basis and its great because it enables us to keep track of all our communication live chat and ticket system with our customers,5
if you have the basic package customer service is very poor,3
great app to support your customers,4
prosvery easy to use offers all required functionality to run a helpdesk in one tool easy reporting functionality as well no training needed for users excellent customer support,5
super frustratingi would cancel but they dont offer refunds,3
prossome of the best features of zendesk are the email management ticket management alert certification and email management zendesk is like having a personal desk assistant through a program that has multiple program offerings that are pretty superb youre allowed to use the program to manage alerts and to manage multiple types of issues in regards to tracking emails and customer issues and resolutions,5
prosi like how easy and accessible zendesk is zendesk has many options to stay organized and track your work,5
proszendesk was our number one and still is choice for implementing a chat on various websites that we managed for our clients the functions are elaborative they display various metrics about the person you are adressing and will program several responses as well its simple and very easy to use,5
its such an simple tool yet so poverfull it alows us to communicate with our customers on daily basis,5
it was good would recommend,5
zendesk is an excellent leading software based on the cloud is easy to use and is an easy and fast way to provide customer service the interface is easy and intuitive which allows agents to be incredibly productive and direct all their energy to help customers,5
satisfactory,4
it works well just tough to get going i have been using it for months and i am still unclear as to many aspects of the program,4
zendesk has greatly improved our customer service we are now able to more efficiently help customers and zendesk helps us ensure we address each customer situation in a timely manner,5
prosthe ability to quickly see if the customer has sent past emails or if this is their first contact as well as the ability to merge duplicate tickets the integration with shopify is also wonderful for quick and detailed order information,5
user friendly direct to the point good ticketing tool,5
i had a great experience with zendesk,5
prosease of usecustomization to business needs integration with good data for visualization easy exporting for analysis,5
prosi enjoy using zendesk for our customer support communication and for our database of support articles the tool is easy to navigate through and there are great options for customizing and filtering and analysis of our support channels,4
zendesk is a very good platform that will help you achieve on any platform your interest,5
pros agent interface really user friendly zd introduces explore that really enhanced the reporting experience,5
prosun outil essentiel pour les responsables de marketing digital dans le retail offrant une plateforme complète de gestion des interactions clients qui facilite la résolution rapide des problèmes et améliore lexpérience globale du service client,5
this product is a solid choice for your help deskticketing system needsit is not the best on the market but it meets the majority of our companys needs especially if the price is reasonable,4
zendesk is a simple easy to use platform to manage our website communications with customers who either are looking to purchase or have purchased from us if gives our company a sense of confidence in that our customers experience remains at a high level,4
overall it is very good i was able to organize all my ticket by creating my own views and i was able to call the staff from different countries efficiently connection is almost smooth depending on your internet connection you can call them via their phone or cellular phone,5
very happy with zendesk would see myself and the teams using it for the future too,5
proslove the interface the help center in particular is well structured and very customizable tthe ticketing system is also very intuitive,5
very easy to use and see all tickets made work a lot easier than you would expect,4
prosthe product does what its supposed to do in terms of chat and support it provides a pop up on your website that people can easily find,3
overall a positive experience,4
prosi like how convenient it is for live support in virtual learning environment,4
prospros of zendesk easy view for client and host easy and effective tracking customizable can integrate with platforms,5
prostheyre doing a great job on building a solid and robust software that has everything you need to organize your customer service team the stats are very helpful i love the interface and even their mobile apps work well,5
prosit is a great product for myself and my team to keep track of incoming and bounceback emails from our customers,4
the crm is great helpdesk is fast and easy to contact and get the issues and questions answered fast,5
we really like zendesk and its a pleasure to use across all of the apps,5
excellent piece of software for customer management feedback and for managing tickets for our helpline which was set up during the pandemic i would recommend it but it is quite an expensive option and its best in class,5
delivering support through various channels can be intricate but theres no need for your customers to be aware of that with the support suite your company can engage in seamless conversations with customers all while shielding them from the operational complexities in the background this solution is both advanced catering to intricate requirements and userfriendly enabling you to start smoothly without delay,5
overall experience i would rate as great tool for the support however some issues can be resolved by upgrading your monthly plan,4
tracking all the contacts and projects we have,5
prosmakes the process of pleasing customers incredibly streamlinedour users dont have to worry about having a hard time reaching us,5
this software is a must for every business to grow,5
i can say that zendesk is very mucb helpful,5
prosmy company used zendesk as a ticketing system it was user friendly searching for older tickets was easy made my job easy,5
zendesk creates a smooth customizable workflow experience agents can spend more time solving tickets then organizing filtering and managing the software it does take some set up to get to this point though,5
proslove the customization options of the platform very easy to use and the ticket workflow is thoughtfully laid out,5
proswide variety of features from ticketing to chat bot widely accepted in industry with ample of resources trained on this tool,4
i was introduced to zendesk an one of my jobs and it was stesful having to rename basic things and fuctions the zendesk way it was powerful and colorful though,5
prosthe solution helps a lot to keep tracking of customer tickets it has various integration options which allows automations and eliminates manual processing,5
prosi like the ticketing system in generalit is amazingit keeps everything in orderit tracks everything incrediblyi know what everything is related to when ive touched it who else has touched it i can pass it on to others easily i can take over things quicklyits so freaking perfect i love this software,4
organization and efficiency,5
weve been able to beat industry standards on first reply time and customer satisfaction despite significant ticket volume while our people have much to do with that it was definitely more difficult before we had zendesk,4
prosthe ease of use between multiple agents makes client communication much easier sharing tickets far better than email,4
good experience no complaints other than the price of the product,4
prosits very easytouse tool with tones of free great apps by far it has great usability also analytical tools are great,5
prosit is amazing to see what zenhub fixes about github you can use it as a jira replacement if you want and not break a sweat,4
my advice to people generally is if youre implementing a new system like this especially in a grid of technology please please please hire someone who is versed pay the money for the set up pay the money for someone who can educate someone else in your company,5
its a great tool but a little pricey for small businesses,3
prosi like how easy it is for customers to ping for assistance and to be able to help them as soon as they inquire,5
proszendesk is flexible and easy to work with it has helped transform the way my business builds relationships with my clientele and target market the bulk text messaging has been awesome for me reaching different target groups and building new and lasting relationships with clients,5
we enjoy using the tool for all of our support needs,5
prosi like how customizable zendesk is we can have different categories available to track emails with that can be unique to the inbox the email was sent to theres also great metrics available on volume and response time so we can track our teams efficiency,4
again easy way for customers to reach out instantaneously if they need further assistance which they usually do because our products can be pretty difficult to sort through,4
we are using zendesk to interface with our members and overall it is seamless,5
intuitive ticketing system all my emails and tickets are organized in a single platform,5
prosvery user friendly way to get vpn access outside of companys firewall due to configurationof certain webbased portals,5
prosextremely easy to get up and running and that goes for the customer too the ability to just loop a support email address into an email thread to create a ticket is very handy the interface is easy to use and after using zendesk less things fell through the cracks,5
un buon software per la gestione nellassegnamento dei ticket,4
muy buena sacándole provecho,5
communication has improved less user inquiries the available information is easily accessible and the overall time gain to focus on other matters is a great improvement,5
prosi can respond to emails and switch to live chat within the same platform plus its customizable workflows and automation features make support tasks effortless,5
i would recommend zendesk to businesses of all sizes the flexibility of the software allows for scaling as your company grows and allows your call center teams to maximize their time spent addressing issues and ultimately help the customer at a quicker pace love zendesk,4
its pretty good it was the very first tool i learned about and it never disappoints ive learned alot from it,5
apart from the fact that zendesk provides centralized support and data for general enquiries it facilitates a powerful reporting of customer satisfaction surveys zendesk software incorporates a large number of apps such as mailchimp shopify xero and othersit also creates an infused knowledge base for users and customers alike,5
i use this to help monitor agent performance and occasionally track down support tickets for users it is a wonderful tool the agents seem to love the user interface and our management uses the reporting features regularly,4
prosim the network and sys admin for government it asked me to install and configure zendesk for their use the installation and deployment was great and easy this days zendesk its almost an standar software for helpdesk was easy to configure and start using it by the it people has all the options that you need to give support to the computers on a large network,5
prosprovides key customer information so agents can provide personal support,4
proswe are using zendesk for our nonit support help desk its okay for nonit function,3
prosi liked the ticketing system concept that all of the relevant information was stored in one place and you could easily include people and they could find all of the context themselves,4
well the tool helps us in communicating to clients through responding to their tickets across different channels,5
proszendesk has an excellent marketing team who design their advertising customer engagement campaigns and marketing website the application itself is pretty good overall easy to use in its basic implementation and fairly straightforward for admins if it didnt go offline have glitches or break it would be excellent,4
prosce logiciel est très bon dutilisation surtout dans des projets marketing rapidesa me permet vite de communiquer mes chiffres daffaires dans le monde entier,5
its been one of the most tools for me in a new role having direct access with out support team but also being able to use it as a resource to troubleshoot issues for my customers on my own as well,5
prosits so helpful with keeping our team organized and making sure that work is delegated equally and attended to,4
overall zendesk chat does as youd expect the macros are wonderful,5
ease of use low cost for small team,5
prosease to manage tickets nice notifications and a lot of features,5
prosthe ability to draft support documents and point people to them from within customer service requests has been great in addition being able to integrate zendesk into the backend of our platform has given our clients the ability to feel supported in all aspects of their experience,4
overall very positive and i would recommend it,4
proszendesk business rules such as triggers and automations are robust and work so well macros and views make day to day support a breeze,5
positive experience overall and i would recommend to future orgs that i work withfor the external userscustomers have always had a great experience as well which is a huge benefit for any org,4
proseasy tokeep track of it requests and histry of conversation comes in the form of an email,5
ottima versatile e completa,4
easier issue tracking and no lost tickets we used to have a hard time keeping track of issues in our support email and which user was taking care of it,5
prosthis is fantastic crm tool for little size companies it enables us to keep worldwide inquires efficient in a prompt way we have the ability to minimize the spam and to improve our procedures,5
prosi appreciate the possibility to work with tickets easy transfer between colleagues,5
overall zendesk is fantastic my complaints are minor but do require human intervention to deal with multiple teams can work in zendesk and achieve support solutions ultimately its great,4
overall zendesk is a great tool that we use to handle emails and user support while i would love for the multiple agents quirk to be resolved it still works perfectly as it is,4
prosthis software really helped me a lot when it comes to assisting customers its very easy to navigate,5
most of our drivers inquiry are communicated through zendesk so it greatly affect our business if we cant be able to use this tool its very essential to us,5
prosi used zendesk as user and it provides great customer support they believe in customer satisfaction which is important for any product,4
prosi like the ease of access to have visibility into large amounts of tickets the categories to divide between work nice,4
proszendesk is vey easy to deploy and use it took less that a week to get entire customer support team acquinted with the software this tool helped reduce our turn around time to customers great investment for a company,5
all tickets,5
overall i wouldnt want to use another software were able to use zendesk to reach our customers and give them the best experience possible,5
prosthe software is great to use for reporting and keeping track of tickets for chats calls and emails,5
prossoftware extremamente robusto em funcionalidades muito fácil de usar e personalizar todo integrado,5
i can say overall zendesk suite is more convenient and easy to use its recommended,5
prosease of use a companybrand thats reputable outages are very rare makes communicating with customers extremely easy,4
proslike that you are able to create a ticket for your needs but limited on the issues that you can pick from,3
positiva en lo general,5
we have a contact center and we need to communicate wit hour customer through different channel ie social media chat call etc zendesk gives you a platform to interact with the customer on a single platform,4
working with zendesk has been great weve been with them for years and have had a great experience with them,5
proszendesk is a great system to track customer reported bugsissues as well as internally reported bugsissues,5
