review,rating
prosthe format of the ticket interface lends its self to serving email based communications very well at a glance i can easily see all tickets sent by a specific requester or business and prioritize based on the severity of the issues being described the help center and chat button that can be integrated into custom applications can be a game changer when it comes to self service inbound and outbound call recordings are super critical especially for our finance team to ensure we have a reliable means of keeping proof of what was said,5
the initial steps of getting everything up and running may require some extra effort and time to navigate through when it comes to customization i have noticed certain limitations within zendesk suite while there are options available i have found that users might feel restricted when trying to customize ticket forms chat widget appearance and reporting templates having more extensive customization options would greatly benefit businesses as it would allow us to align the software more closely with our branding and specific requirements this level of customization would help create a consistent and personalized experience for our customers,4
overall positive i liked being an admin greatly as well as i like being a user submitting my concerns to different companies and brands seeing them use zendesk makes me feel good knowing they are using a trustworthy product i also know if they dont respond easily it must be on them as a company as everything is tracked such as time and date so it is easy to set ttr metrics using this product,5
my overall experience with zendesk has been phenomenal as our employees have taken a very big liking to it which allows them to enjoy their jobs more resulting in greater and more efficient work flow for the rest of the business zendesks own customer service has been there when we needed them and for that we are really thankful even though they are rarely needed due to the stability and ease of use of the service,5
my general experience has been perfect it makes my work exceptionally simple with regards to giving client support and approach client information to all the more likely help i enthusiastically suggestall in all zendesk suite is a useful asset for overseeing client care tasks its broad highlights including call logging call directing continuous endlessly talk records make it a thorough answer for smoothing out client collaborations while it very well might be delayed on occasion the general involvement in zendesk suite has been positive giving a solid and effective method for overseeing client service,4
this software has been really efficient since not only it allows to give a good attention to the client but also it is possible to do a followup to the attention agents to know who stands out the most who are available to take care of the client and this makes that not wait for any client but all are served in the best way possible and you can solve their problems in the shortest time there is also no way to have a collapse in the channels as there are different channels of attention that can be chosen to suit each client that is why i think zendesk is a tool with great potential and can be used in any type of company regardless of the size of it,4
overall our experience with zendesk as a support ticketing system has been good while a bit expensive for the amount of features we use the integrations and automations available work well with our current client workflow and processes,4
zendesk is so robust but it is not at all intuitive learning how to generate a report was a full time job and i never quite figured it out to really get comfortable with tracking the mass amount of data we had generated through all of our ticketshowever i really wanted to learn it and their customer success team worked with us to help develop trainings so we could utilize it better,4
despite the small problem i had with the learning curve initially i felt that as the months went by i gained greater mastery and speed in solving all types of cases using this platform the ease of integrating it with other company systems such as crm and automating processes was highly valued overall i find zendesk suite greatly streamlined my daily tasks as a support agent focusing more on the customer than the systems i would definitely recommend this solution to any company that needs to provide operational excellence in their help desk,5
overall zendesk is an easytouse reliable crm platform that integrates well with most popular order processing platforms webstores shipping logistics services and can handle intricate operations such as subscription administration phone calls live chat support and more also the reporting features available offer alot of flexibility to create reports that are helpful for your business and goals in customer support i chatted on zendesk daily and love the way it handles live chat support for agents,4
zendesk suite is good for businesses as it centralizes customer inquiries enables efficient tracking and resolution improves response times enhances collaboration among support teams and provides valuable analytics for performance evaluation and continuous improvement,5
in my overall experience with zendesk suite it has been a gamechanger for my business resolving critical pain points and delivering a range of benefits as a small business owner i faced several challenges in managing customer support effectively but zendesk suite has transformed the way i interact with my customers and streamlined my support operationsfirstly zendesk suites multichannel support has been a lifesaver with the ability to manage customer queries and issues across email live chat social media and phone i can meet my customers wherever they prefer to reach out this has significantly improved customer satisfaction and response times as i can provide timely assistance on their preferred platformsanother standout benefit is the integrated knowledge base offered by the suites guide module creating and publishing help articles and faqs has empowered my customers to find answers on their own reducing the strain on my support team this selfservice option has not only saved time for both my customers and staff but has also improved customer engagement and empowered my customers to troubleshoot common issues independentlyfurthermore zendesk suite has helped me gain valuable insights into my support operations through its reporting and analytics capabilities with explore i can track key metrics monitor agent performance and identify trends to make datadriven decisions this has enabled me to optimize my support processes allocate resources,4
ticket management live chat call center integration and knowledge base management but also the ability to customize the software to fit specific needs is a major bonus,5
zendesk suite è una piattaforma di supporto clienti completa che offre molte funzionalità tra cui ticketing chat conoscenza base analytics e automazione queste funzionalità aiutano le aziende a fornire un supporto efficiente e personalizzato ai clienti zendesk offre anche molte opzioni di personalizzazione e integrazione con altre app e servizituttavia zendesk suite può essere costoso e complesso da configurare e utilizzare per alcune aziende e potrebbe avere limitazioni nella personalizzazione e nellintegrazione inoltre linterfaccia utente potrebbe non essere intuitiva per alcuni utentiin generale zendesk suite è una soluzione potente e completa per le aziende che cercano di fornire un supporto clienti di alta qualità ma è importante considerare i propri requisiti e valutare se soddisfa le proprie esigenze,5
our experience with zendesk suite has been extremely positive the software is intuitive and easy to use making it simple for our team to efficiently handle customer inquiries and concerns the ticket management feature in particular has been incredibly impactful allowing our team to prioritize and organize customer inquiries in a way that maximizes efficiency and effectivenessthe sales pipeline management feature has also been a valuable asset as it helps our team stay on top of potential sales opportunities and effectively manage and close deals the multichannel communication feature is also a standout as it enables our team to communicate with customers through a variety of channels providing convenience and flexibilityintegration with other applications and services has been seamless allowing our team to easily access and utilize the information and tools they need to provide the best possible customer support the reporting and analytics feature provides valuable insights into customer behavior and preferences allowing us to make datadriven decisionszendesk suite has been a valuable asset to our company helping us to improve our customer support and resulting in a positive customer experience its also worth noting that zendesk suites customer support is topnotch they are always available to assist and answer any questions and they constantly release updates to improve the software,5
prosone of the things i like most about zendesk suite is its ability to centralize and streamline customer service operations zendesk suite offers a wide range of features such as helpdesk ticketing live chat phone support selfservice portals and more which allows businesses to manage customer interactions across multiple channels this makes it easy for businesses to provide fast efficient and personal customer service which can be particularly important for businesses that rely on customer loyalty,5
zendesk has been helpful for us to help collect our emails form captures and calls sort them within a ticketing system and prioritize the tickets as needed and send them to the person who will reply not having someone who has to answer the phone and then pass that message to the appropriate person is a big help for us,4
for a company that specializes in customer service they are a joke it takes several days to get a response from someone you will never get support from someone in your time zone so when they do respond it will be during overnight hours they also will not have a phone number or post their working hours in their signatures they dont even use their own product correctly i have received emails showing one name in the from line and a totally different name in the signature their automations will also send at inappropriate times i responded to an agents request for more details the agent responded and stated that they are working on the issue soon after i received an automation stating they havent heard from me and are closing the ticket they will also try to charge you to get your data exported dont fall for it there are free programs that will do this for you quickly and easily including all of your knowledgebase articles and the images associated with them when importing to another system you will need to reinsert the images within the articles because they are no longer hosted on zendesk but the free export programs offered by competitors will name the files in a way that makes it clear and easy to identify which image goes where,3
zendesk provided us with great flexibility to deal with customer requests and inquiries and enabled us to increase the speed of response as well as enable us to document all procedures automatically and the reports it provides to us are comprehensive and we can always take advantage of them to develop our operations,5
customer queries used to be managed in excel still it was timeconsuming to track history and the status of responses could not be managed resulting in cases where there were omissions in responses however with the introduction of zendesk it is possible to aggregate by tags and monitor trends easily since it is possible to manage matchno match status there are no match omissions,4
we are really pleased with the zendesk platform since then weve seen an increase in the quality of service we provide to our customers i particularly appreciated the ease with which a new manager or technician could be added to the system without requiring a significant overhaul of the dashboard,4
using zendesk our customer care representatives are able to obtain the information they need on their own when i handle the articles i hear nothing but good things about how this program makes my job easier and more productive they may use slack to look for answers and the results will be linked to relevant articles in zendesk zendesk may be easily integrated with other services such as slack,4
zendesk is our ticketing platform at present again it helps us connect with our employees who need assistance whenever necessary another feature of the software is it can host a page containing a library of helpful articles and documentation for our customers these articles can also have secured visibility by assigning user segments allowing us to manage effectively,4
zendesk provides a good ticket management system knowledge base platform hosting documents with securitybased permissions and insights comparing to competitors such as freshdesk or jira even though they are cheaper they cant provide the functionalities that zendesk provides zendesk allows us to perfectly track our cases analyze the performance through insights allowing us to understand what we have to improve in order to improve our customer csat,5
zendesk is the most customizable ticket system in the market a lot of features that can help to automate things plus you can also install apps that could be useful,5
ive used zendesk in all of the ventures ive participated in unfortunately i get it that in it was an easy option but today there are plenty more and plenty of options of building out solutions yourself if customer support means everything to you,1
customer support is terrible they do have an unqualified customer success team we requested a feature and it took them over months with emails back and forth to let us know they can get it done when i tried to cancel the contract they said we can not cancel it because you have another year on a contract which was incorrect the success manager was still thinking we are in after i pointed that out they still refused to cancel the contract my advice to this company is a legacy and you should look into a more modern system and there is alot of them out there,1
while there are a couple of issues with zendesk overall i find it a far preferable option to dealing with these tickets through email slack or a personal basis barring cases where this would be the better solution if you are getting enough volume of tickets that support ticket software seems like itd help your business you can afford to get it,4
zendesk has helped me to perform better the solution of any problem that our clients may have has given us the possibility of creating automatic responses through different forms of communication thus it has made my work so fast and easy its reporting function is also really very beneficial to see what the trends are in sending emails to our dissemination team zendesk has a great possibility to gradually increase the functions of our companies helping us to move towards success in a reliable and safe way,5
overall zendesk allowed us to create a new ticketing platform and process for the business its integration with slack drove great user adoption and encouraged submissions this platform allowed us to report on the most common it and biz ops issues at our org while allowing agents to service and help the team effectively its pretty ideal that you can manage your workload triage requests and reply to folks all in a few clicks its really allinone if you integrate with your crm too,5
we used zendesk at of my last jobs the last at my suggestion we handle a diverse amount of different customer issues and its a great system to manage and track all the different interactions our customers are having as well as the agents that are handling them,5
i cant stress enough how easy zendesk makes it to pass tickets back and forth between people and teams my team gets a constant flow of tickets and we are able to keep them organized by time urgency and topic all customer emails and voicemails that are incoming to my department are received in zendesk and its very simple to either respond or make a note and pass along the ticket to the correct person zendesk contributes enormously to my companys efficiency and overall organization,4
overall zendesk makes customer service more efficient as a manager im able to see my employees satisfaction ratings how long they spent that day answering emails how long it takes them in general to answer an email how long they spent on the phone etc zendesk has been great in streamlining my customer service team while also optimizing the customers experience,5
prosi struggle to find good things to say it works and rarely has performance problems if you need very basic support ticketing and are just starting out you could use it and be successful we did but the functionality and support for those organizations between startup and large corporation is nil if we were a very large organization i could see it being a valuable product,1
zendesk is an easytouse dynamic intuitive customer service tool that allows the use of macros to optimize messages to customerszendesk is easy to implement and with adaptable prices i have recommended this tool to several friends for their organizations,5
zendesk really is the best crm i have ever used and i was in customer service for years by far and away the most intuitive simple and clean user experience you will have for a consumer facing cr interface,4
we use zendesk to manage our inbound support account service helpdesk and requests from our contact page in order to communicate with users we collect bug reports and enhancement requests from users and can troubleshoot and monitor requests through various systems we have integrated it is the foundation on which we base the way we interact with our customers when they come to us,5
a wonderful tool to have on our resort website this tool has helped my team and myself close sales in less than mins definitely a great tool for support as well its a faster and convenient way for clients to reach out to us and get information which leads to great costumer service my team is very satisfied with zendesk chat and we look forward to its continuous updates it is part of our sales support team keep up the good job,5
it did the job we needed it to do until we found a better option,3
prosthis software allows me to take calls handle tickets handle chats and review my internal resources in one place different departments have different queues to keep everyones work separated and with a quick switch of an assignee you can escalate or deescalate tickets as needed the software allows the creation of macroscanned responses that can be limited to specific teams but are easily accessible whether it be for a ticket or a chat the phone call plug in and chat plug ins are easily accessible as well and can be deactivated for users who should not have access to those features the chat and phone call notifications are loud and consistent so an agent wont ever miss a service request unless due to negligence or poor connection you can customize how many chats an agent should handle at a time and how long an agent can get wrap up time after a call tickets are automatically populated after a phone call or chat has been established so an agent can follow up with a customer after theyve spoken with them in real time other features of zendesk that i like is it can be used as a help center for faqs and an onboarding site so you can use it for job postings to outline the criteria for jobs or gigs and for the application,5
zendesk has been an amazing tool you have all the options you need to work more efficiently and as part of a team it has so many features that you never stop finding new options to improve the work in the team it is user friendly and it has a clear interface you just need to take your time to find and learn how to apply all the features to your everyday taks i will definitely recommend it,4
in conclusion zendesk suite is a powerful tool for managing customer service operations its extensive features including call logging call routing realtime chat and chat transcripts make it a comprehensive solution for streamlining customer interactions while it may be slow at times the overall experience with zendesk suite has been positive providing a reliable and efficient way to manage customer support,4
to be honest the overall experience after using zendesk in our department has been great we are always on top of our metrics and this is mostly because the platform helps us run our business smoothly ticket automation and being able to customize our ticket system so it can fit our specific needs is one of its best features,5
overall zendesk is great helpdesk and provide multiple features that an enterprise need to handle huge customer base and track tickets and complaints on the go they should think of support system in mobile app too also i am not much satisfied with their customer support as they couldnt resolve many of the issues like reviving a lost ticket forms due to mistakenly closed issues,4
the worst customer supporttheir product appears to provide so much but its so convoluted that its nearly impossible for new customers to set up without assistance from the firm however whenever we met with someone who managed our account we expressed our worries about not knowing how to perform certain things what would be the reactions ill email you zendesk support articles okay ive been googling it and plainly it hasnt helped which is why im requesting assistance from a zendesk representative we were advised that if we stated that we needed additional assistance we would have to pay a large sum of money to have a specialized person assist us were already paying so much to utilize your platform which has so many technical issues at the very least provide some sort of helpneedless to say we left after years of struggling to use their platform thanks for never helping,2
we are using zendesk for all support and it has been greatour customers view us as a big company and we are a small companywe love zendesk talk as it has saved us from implementing a phone system,5
the time savings across departments are massive and it has allowed us to have a much more joined up and structure approach across our business it has also dramatically improved the service we can support our clients with due to better prioritization visibility and workflows applied to tickets,4
tremendous scaling benefits adding more users is not just easy but we have recourse to ensure that our teams can grow at their own paces without worrying if the software can keep up zendesk can absolutely keep it it does not even flinch,5
id definitely recommend zendesk to others its an easy to use software widely known and our clients really benefit from it,5
profoundly amazing giving the best experience to customers and creating a wonderful working environment for all,5
zendesk is super easy to use and to communicate with different other teams is very easyverygood customer support and it has support zendesk has a great job in seriously improving their product listening to their customers and releasing new features to make their customers feel very happy it is fully featured and comprehensive,5
with zendesk suite i was able to resolve customers apprelated issues which really helps both me and the company i was able to earn incentives with the customer satisfaction i am getting and the company is able to gain more customers given the good customer service they are receiving and this is all with the help of zendesk suite couldnt have thought of any other tool we can use that can be easily navigated and has most of the features that we need,5
overall my year experience using zendesk was incredibly positive i enjoyed both using it and configuring it and would easily recommend it to others plus i think their support team did a great job whenever we had a question we always got effective and timely replies,5
overall working with zendesk has been a breeze its userfriendly simple and quick the zendesk team is always available to answer questions or help you pull reports i never want to use another ticketing system,5
overall a great piece of software i would say its easy to use has so many addons out there as well it feels like you can customize it to work the way that you want to work with it,4
its the most customized and more simplified software which gives you the chance to install apps which you may have found usefulits the bestthe experience was satisfying,5
proszendesk makes it easy to manage your supportcustomer service queue offering a userfriendly dashboard custom modes for communicating with userscustomers and bench marking statistics both within your team and against industry averages that help you understand how you stack up against other team members as well as competitors with such a vast database of industries within their portfolio zendesk has been able to optimize their system helping businesses across the business spectrum have used this software in different industries and it is responsive to all types of support communication also gives businesses the ability to customize their system which allows for a great feelbranding opportunity in some cases,4
