review,rating
zoho desk is a toptier platform for developing individualized customer service offerings its a separate platform connected to the company that has all the greatest capabilities for prioritizing requests managing the requests and closing more and more requests ive been using zoho desk for quite some time now and its been invaluable for streamlining my operations and those of my customer service staff,5
provides webbased customer support reducing workloads and leaving our customers happy and confident in the support we provide them,5
zoho desk is a great tool with many features it seems some features may need ironing out or better documenting but otherwise it is a very useful tool that could be extremely valuable to many businesses in all different industries and niches it is perfect for anyone who just wants a simple email ticketing solution but for those wanting to use the help desk knowledgebase solutions you may want to set aside some time to fully understand how it works and how to best use it,3
zoho desk is very responsive and fast is packed with useful features and easy to use for everybody,5
questions about orders or invoices tickets and customer administration we were able to streamline our operations with the support of zoho desks improved visibility timeliness and visibility into the resolution of open questions,4
maintain the things we offer by attending to the routine upkeep tasks that clients email us about provide a formal record of the work completed and check to see that our employees are following through,4
great support solution for tickets and addressing customer needs,5
overall zoho desk is a great app in managing customers issues really helped the company with customers issues,5
prosi was highly impressed with zoho desks intuitive interface and comprehensive feature set the platform is exceptionally userfriendly making it easy for our team to manage tickets efficiently one of the standout features is its automation capabilities which significantly reduce the manual workload by routing tickets based on predefined rules this has led to a faster response time and increased customer satisfaction additionally the integration with other zoho products and thirdparty tools is seamless providing a unified approach to our customer service processes,4
prosthe basic view the volume of incoming tickets it supports the fact that it does not have problemsbugsdowntime,5
great and their customer service is great as well,5
many highlights and various ways of communicating with potential client base as a web engineer coordinating it into my site was shockingly simple and smooth we see a ton of potential for smoothing out our deals cycle decreasing information section errands while having the option to arrive at additional clients consistently without the requirement for a meddlesome contact structure and call that a ton of the more youthful customers are staying away from in these business sectors,4
an aweinspiring tool that allows us to use it in so many ways as a helpdesk as a tasks manager and as a dispatchit does well to do most of what other providers give you for very little cash,5
the initial setup was quick and easy and since then it has been very smooth the team enjoy using the software the customers are feeling the benefit of the reliable ticket features,4
we are happy because we also use zoho crm and then we have all the end users info in one place we can check all the tracking since the lead born and how we attended each customer including help desk ticketing,4
prosemail management this was the whole reason the company i work for got zoho desk we have been using just a normal email provider and it made it hard for us to maintain accountability if a colleague did not sign the email with their name zoho desk made it easy to make sure the workload was evenly assigned and provided us with the ability to maintain accountability when errors were made with customer responses when new emails came in it would assign it to whoever was working emails for that time being if the person who got assigned the emails wasnt able to respond with or know the answer to the question the customer was asking it would be easy for them to reassign the emails to somebody else that would be able to respond correctly the integration of zoho desk was easy it didnt take us long to get the hang of it,4
overall zoho makes life easier ai assisted chats are helpful if you are set up properly most importantly it is user friendly and you do not need special training to be able to set it up thay have it all in their help pagezoho also is not sensitive to ip addresses it is accessible everywhere and is very helpful to companies that employ remote workers,5
the entire company uses zoho desk to manage our daily processes and report on our projects we track our daily records with all the basic modules such as contacts accounts and transactions we have customized most of these modules to better reflect our own internal processes as this is easy to do in zoho desk the builtin reporting features allow us to easily customize reports the way we want giving us excellent business insights,5
zoho desk has allowed us to effectively manage our security incidents and requests providing quality support to our customers,5
prostask management and ticket tracking and remote control chat,5
overall its a very good software in terms of usability happy with this,5
userfriendly and reliable software my experience so far is great and i would recommend it,5
aside from a few odd issues mentioned previously zoho desk does its job well i wouldnt call the software outstanding by any means but it doesnt get in the way of my job,4
excellenti recently had the pleasure of using zoho desk the customer service and helpdesk software i found that the software was very intuitive and easy to use with a well laid out dashboard that made navigation effortless the various features like ticketing system knowledge base and customer selfservice portal make managing customer data simpler furthermore i found that i could customize the software easily setting up automated workflows and addons to better suit my specific needs,5
makes customer management extremely easy once you get going,5
the technical support team of a technology company is perhaps the part of the organization that is more in contact with end users from here start all the requirements fault reports and claims for the same provision of services having a tool that allows direct contact with users by providing the means to approach our organization leaves very high quality of service and satisfaction of the same customers zoho desk with the quality and multiplicity of functions allows both our team and the same customers to have a pleasant experience with the technical support group and incidentally with the organization which is left with an excellent impression to customers,4
for our company our customers are the most precious asset and their satisfaction is an extremely important aspect for us in which we work daily to maintain and even increase it as much as possible we implement new techniques to favor customer relationships and generate trust and an overall exceptional experience while they are using our services it is here where zoho desk takes the place and plays an important role because thanks to its implementation we managed to improve response times to their requests customer service agents can view and manage tickets more efficiently and easily which has allowed us to respond to their queries quickly and effectively this has undoubtedly led to a significant increase of approximately in their satisfaction we have really benefited from the use of zohk desk,5
using zoho desk i can see how quickly each issue is being responded to and make sure that our support staff isnt slacking off from the perspective of the client this appears more polished,4
we were having a hard time managing customer service and support because customers could contact us through multiple channels and we didnt see how they were interacting with us we were able to address these issues and streamline our customer support processes with the assistance of zoho deskthe capacity of zoho desk to incorporate multiple customer service channels into a single platform is one of its primary advantages we can manage support tickets phone calls emails messages on social media and more with zoho desk we can also manage our support operations more effectively with the help of a wide range of features and tools offered by zoho desk we can use analytics and reporting tools to gain insight into our customer support performance automate routine tasks and create custom workflowsin general zoho desk has assisted us in raising customer satisfaction strengthening our relationships with them and raising the standard of our customer support and service,5
overall i found the zoho desk user interface to be great its easy to navigate and create tickets which saved me a lot of time and effort i would highly recommend this product to anyone looking for a good ticketing system,5
we looked at a few others salesforce freshdesk and others and were surprised by many of the features there were many zoho branded products and services available that seemed to work well during testing the interface and mobile apps were fairly intuitive and we were able to get a fully functional demo up and running in a matter of hours without much trouble we evaluated it with other software at the same time so lets compare how long it took us to get it up and running and use it functionally with other systems,4
invaluable progress has been made in facilitating communication helping us more effectively assist and guide customers who have questions or concerns about our offerings because of the faster resolution of customer issues we have also seen a rise of at least in the number of new customers requesting our services,5
in short zoho desk has enabled us to raise the level of the service center for assistance provided to our customers and indeed the response time has improved and the distribution of tasks to team members has become easier in addition to that zoho desk has enabled us to better measure the extent of customer satisfaction with the services provided,5
prosmagnificent software simplicity is under the most favorable conditions the effortlessness to designing the product awesome method for working at the interface following of the ticket and the acceleration framework enables the organization to track and deal with the client issues on time zoho desk is a help work area stage that enables organizations to convey top quality client support to their customers with instruments that expansion operator profitability and examination and reports that empower supervisors to discover enter issues in specialist exhibitions so they can enhance their administration also settle on keen business choices clients can likewise profit by zoho desk as the product enables them to discover convenient and important help without going too far with zoho desk organizations furnish their help groups with the best devices various help channels and assignment computerization so they can convey brisk and responsive help to their customers this assistance work area stage assembles representatives from different divisions and engage them to give their clients an extremely brought together client benefit involvement this administration totally supplanted the method of association with email telephone calls visits informal communication stages on a solitary stage this totally disentangles the way toward getting a demand for client bolster due to this we have turned out to be speedier to serve our clients whats more clients can gather tickets in their local dialects since such an open door is available incorporation zoho desk with zoho crm was a standout amongst other things that we finished for the current year reconciliation was speedy and effortlessly two administrations are just made for each other and have great reconciliation the help group is basically incredible much obliged to all the folks who helped us with incorporation and did everything in the most brief conceivable time coincidentally they are neighborly and active its pleasant to manage the expert,5
zoho desk is a pretty nice tool because it lets us bring all our customer service stuff together in one place we can handle support tickets calls emails and even social media messages right in zoho desk its got a bunch of handy features and tools that help us run support smoothly we can check out how were doing with analytics automate boring tasks and set up our own custom workflows long story short zoho desk has made our customers happier improved our relationships with them and kicked our customer support game up a notch,5
es una herramienta muy buena para organizar las incidencias con los clientes permite una buena organización y priorización de los tickets así como la creación de varios departamentos en función de la incidencia y prioridad,5
genial todos los tickets de la compañía se atienden en tiempo y forma y permiten el dimensionamiento,5
i had the chance to use zoho desk as an intern in the universitys pharmaceutical research and development division to handle customer service enquiries pertaining to our research projects the application was effective in managing and resolving customer issues we were able to properly track and prioritize requests using its ticketing system resulting in prompt responses and resolutions our connection with customers was streamlined because to the automated capabilities like email templates which ensured consistency and saved time the collaboration tools in zoho desk enabled our support team members to communicate and coordinate easily overall zoho desk greatly enhanced our customer care procedures allowing us to give our stakeholders timely and effective service,5
to keep tabs on the many ways in which people have reached out to us with questions about our bespoke productsemail phone and even inpersonwe have implemented a ticketing system in zoho desk we have a long way to go until we fully integrate the system but so far what weve seen we like what we see,5
in general terms a very good experience a tool that makes our work much easier by optimizing procedures,5
it helps in managing assets inventory ticketing it increase team efficiency to work with better trackability and meeting of sla,4
zoho desk is now being utilized by our customer success and professional developers and has helped us keep track of all the questions and concerns raised by our existing clientele and respond to them as quickly as possible,4
zoho desk is a solid customer service software option that offers a range of features and customization options however businesses should carefully evaluate their needs and compare zoho desk to other options to determine if it is the right fit for them,4
zoho desk has enabled us to interact in an innovative way with customers and increased the cooperation of team members to ensure that all open tickets are closed and all inquiries are answered in the specified times and without delay which raised the level of satisfaction of our customers with the rapid response to them,5
overall we are enjoying with the zoho desk featureswe have configured it with our internal it department for resolving ticketing of internal employees,5
proszoho desk offers a wide range of features including ticket management multichannel support selfservice portals automation sla management and reporting,3
all issues related with our hardware and software are logged and tracked byt creating ticketscustomers can followup tickets themselves and issues that come back often can be moved to a knowledge base some kind of faq to lower the support load it has good features to divide tickets between our products and departments,4
en general han sido todo un descubrimiento conocer la herramienta con tanto potencial y tanta usabilidad ojalá pronto añadan módulo proveedores y módulos personalizados con eso lo petaria,5
overall zoho desk is pretty much helpful if you are established your paws into a niche market and want to help your customers by providing proper services free version might lack some crucial features but you still can be able to handle much more without paying much for start learning curve is for non technical people hence one should understand the semantics of each tab,4
experience an automated support selfservice management and professional customization,4
zoho desk has been an invaluable tool its ability to automate tasks and centralize communication is impressive efficiency and communication management is improved with this platform,5
zoho ma permet de me rapprocher de mes clients et surtout dêtre présent en temps réel à tout moment de leur inquiétude,4
a goodlooking dashboard and customizable reports make a significant difference from other products i used i am a visual man and it is very important for me to have a great visualized report,5
im happy because zoho desk delivers great customer services,5
this tool helps our team to manage invoices and support related issues and personally im satisfied with it,5
prosi can have detailed control over tickets and manage them it is an excellent tool as it is very easy to use excellent knowledge base easy integration and the creation of an sla allows you to control whether they are complying or violating in relation to different projects and each one with its own particularities,5
prosone of the biggest pros of using zoho desk is its ease of use the software is straightforward and intuitive they have an excellent customer support which is crucial when dealing with technical issues another pro of using zoho desk is its customization options the software allows me to customize various aspects such as ticket fields layouts and workflows to match my business requirements,5
prosthe integration with zoho crm is gamechanging its so simple to set up and gives our sales customer service teams complete transparency into what the other is doingits really intuitive of all the zoho apps desk is the best for easeofuse and straightforward ui i like it even more than zendeskpowerful automation featureslove the customer portal knowledge base we use it every daynice little features like snippets or copypasting knowledge base articles mean that ticket response is a breeze,5
prosthe dashboard is beautiful takes less time to try figure out the featuresits user friendly is something i like i dislike those tools with very complicated processes and zoho desk is definitely the best with very simple and clear language easily customizable to fit your needs zoho desk has really helped us to answer clients queries on time and this has greatly and positively impacted our productivity when a customer is happy with the services he or she will refer others and we could be more happier with zoho desk live chat feature helps us answer and sort queries in real time fairly priced compared to similar tools free plan is very thoughtful and you can always start with this as your progress to the paid version for more features ticket creation is fast and easy zoho desk integrates well with other zoho products,4
prosil vantaggio principale è quello di poter far confluire le segnalazioni dei nostri utenti allinterno di ununica piattaforma e di poterle categorizzare al fine di analizzare e migliorare il servizio di assistenza interna,4
the efficiency and competence with which this initiative has been launched is commensurate with the degree of support we had hoped to achieve our customers benefit immensely from its ease of use and practicality notably in contact management allowing us to answer their questions and handle their issues if you want to invest in your infrastructure use this program the deployment of this system has been crucial in cutting down on costs connected with providing support to customers thanks to its handy features youll be able to respond to any concerns that arise from customers,5
i realized i need a product that will fully integrate with my google contacts and calendar be able to track time spent on site or on a remote support session and be able to do this without switching and spending minutes trying to get all of the information together for an invoice from contacts reentering the same job in invoices instead of it linking to desk and move on to the next client,2
this is a solution that provides our customers with the most effective and personalized attention it has facilitated and improved the complex work of customer service making it a much simpler proactive and productive process,5
by delivering a plethora of applications in one convenient package zoho one helps organizations with a wide range of issues the technologies work together seamlessly eliminating the need to jump between applications to complete a single task this helps organizations save a ton of money and effort which they can use into expansion rather than managing various software systems furthermore teams are able to collaborate and produce superior outcomes because to the wellintegrated and userfriendly tools available across all platforms this facilitates effective communication and collaboration among geographically dispersed teams,5
overall it is a good starter product and is helpful but a lot of tweaking is needed and the product offering is geared to pull you towards needing the pro package one day i may choose that but wish i could have a vanity url for email now with a one time fee,4
proswhat i like the most is that it really is very intuitive and easy to use it helps to control the tracking of every ticket in a easy way also one can import its customers without any problem it has many other tools that can be useful regardless the item which company is using on day to day basis it can start a live chat with the user and can go straight creating a ticket from this internment ticket tracking and escalation matrix enables company to track and manages customer complaints on time,4
overall experience is positive but not perfecti would recommend zoho as a serious option for most mid size organizationstheir support is hit and miss just depends on who you get but they are continuously releasing new versions and have an active support line,4
as i mentioned in cons support is horrible and they need to focus on getting current modules working without bugs rather then what additional modules they can create to charge people fori be happy when our company finally pulls the trigger and goes with another vendor,1
my experience everytime is a good one i love it all over again when i use zoho desk every day of the week,5
zoho desk helps businesses organize their affairs manage customer interactions and structure their way of dealing with customers our support agents can readily get information and answers from the customisable knowledge base within zoho desk we employed a reporting tool to have a better understanding of our support desk and future difficulties,5
prosi would first like to appreciate the most beautiful and fully designed dashboard everything is crystal clear very simple to set up and use zoho desk is customizable to your liking this means it works for you and you are certain of desirable results the software is fairly priced saves money customer careis a very responsive and informative it intergrates well with other zoho products i use and this simplifies my work free version is a brilliant idea i used this before and now i use the paid version tracking tickets and agents has never been this easy i do this from the dashboard without any struggle,4
conseguimos abrir solicitações dos clientes facilmente mas vejo que poderiam liberar mais funcionalidades com integração ao whatsapp business tradicional e integrálo ao zoho desk somos do brasil e muitos clientes usam muito o whatsapp para abrir solicitações,5
i give it the highest rate when it comes to all dimension above and whats not mention above i was in a different level before i start using the whole desk so im highly recommending it to others and i really can count on it,5
proszoho help desk is easy to use and it has a nice search feature for going through your tickets youre able to see other employees looking at your tickets and youre able to make comments on the fly its very basic and you can create different ticket systems for your clients as well i found that zoho was the easiest help desk service i have used to date i would also like to add that vault is a great password feature if you use help desk they work with each other very well,5
our business has found that zoho desk has even more functionality than we thought we are able to add several departments to make our work much more efficient thanks to zoho desk,5
we are using the system to log all customer faults making it easy to invoice for the time spent and also as a handy knowledge base for future reference,5
we picked zoho because of the worth and in this manner the indisputable reality that we were at that point familiar with their product arrangement as we utilize their survey programming too things were getting lost or overlooked about and it had been making me insane zoho has a great setup of items and this one isnt any special case simple to utilize the essentials at any rate whats more its very reasonable,5
nice but not best just because of poor support,4
overall the zoho desk platform has been a good move for us we switched from using zendesk and have not looked back since there are tools in desk that you can import your zendesk info to aid in migration to make it almost seamless as with any other tech platform made for larger scales of users there are some things that are frustrating because that is not how we want to do it but the system has enough features to be able to work around those frustrations and continue with the process,4
