review,rating
despite the pricing and reporting drawbacks i found freshdesk to be a valuable tool for improving customer support and increasing efficiency the platforms robust features and integrations including with salesforce and slack make it a top choice for businesses looking to streamline their customer support operations,4
freshdesk is an easytouse customer support platform that enables support teams to effectively manage customer requests via multiple channels such as email live chat social media and phone calls freshdesk features include ticket management knowledge management reporting and analytics as well as customisation of the user interface to meet your specific business needsusers generally appreciate the ease of use of freshdesk as well as the ability to customise the platform to their specific needs in addition the user interface is intuitive and easy to navigate making it easy to manage customer requestshowever as with any software platform there may be potential challenges or issues encountered when using freshdesk such as system stability issues or high fees to access the platforms full functionality it is important to take these factors into account when evaluating the overall experience of using freshdesk,5
freshdesk has been a comprehensive and intuitive help desk solution for our organization we have been impressed with its automation and reporting capabilities as well as its userfriendly interface although there were some limitations we have been very satisfied with our experience with freshdesk and would highly recommend it to any organization looking for a powerful and affordable help desk solution,5
i have had a great experience with freshdesk it is a comprehensive customer service and help desk solution that helps businesses improve customer satisfaction reduce customer support costs and increase overall efficiency the user interface is intuitive and easy to use plus it has features specifically designed for customer service agents such as automated ticket assignment rules canned responses multichannel communication options including email and chat reporting tools to track response time and performance metrics additionally the platform offers integrated solutions that can be customized according to specific business needs such as integrating with popular crms like salesforce or zendesk the most important feature of freshdesk that i found appealing was the ability to manage multiple accounts from one centralized location,5
freshdesk has helped me solve a number of customer servicerelated business issues the management of customer inquiries and requests received via email the web phone chat and social media was one of our biggest challenges we were able to consolidate all of these requests and track them in a single view with freshdesk making it simpler for our agents to keep track of all conversations and respond promptlysince implementing freshdesk we have experienced numerous advantages due to the effective automation features that cut down on repetitive tasks our agents are now able to maintain their highest levels of productivity we have also benefited greatly from freshdesks omnichannel capabilities which enable us to automatically route requests from various channels to the appropriate agents we have also been able to improve our capabilities and streamline our proceduresin general freshdesk has revolutionized our customer support team it has made our agents more effective and productive as well as helped us provide better customer support the software is affordable userfriendly and provides excellent customer support freshdesk is definitely something you should look into if you want a customer support system that works,4
je suis extrêmement satisfait de freshdesk en tant que solution de gestion de service client le logiciel est très facile à utiliser avec une interface intuitive qui permet de gérer rapidement et efficacement toutes les demandes des clientsla fonctionnalité de ticketing est particulièrement utile car elle permet de suivre facilement les problèmes et de les résoudre rapidement de plus freshdesk propose de nombreux canaux de communication tels que lemail le chat en direct et les réseaux sociaux ce qui facilite la communication avec les clientsen outre loutil de reporting et danalyse est très performant ce qui permet de suivre lévolution des demandes des clients didentifier les tendances et de résoudre rapidement les problèmes avant quils ne deviennent trop importantsdans lensemble je recommande vivement freshdesk pour toutes les entreprises qui cherchent à améliorer leur service client cest une solution de premier ordre avec une excellente équipe de support qui est toujours là pour aider,5
overall freshdesk has helped our businesses provide better customer support improve efficiency and increase customer satisfaction it has an easy to use sleek web portal,4
as a user of freshdesk i can say that my experience with the software has been positive freshdesk has helped me manage customer interactions efficiently on a daily basis the softwares intuitive interface makes it easy for me to navigate and access the various tools and features that i need to manage customer inquiries and support requests,4
di recente ho iniziato a utilizzare freshdesk come software per il servizio clienti per la mia piccola impresa prima di freshdesk utilizzavo una combinazione di email e un sistema di helpdesk di base ma man mano che la mia attività cresceva avevo bisogno di una soluzione più solida allinizio ero intimidito dallenorme numero di funzionalità e opzioni di freshdesk ma dopo aver passato un po di tempo a esplorare la piattaforma mi sono subito reso conto di quanto fosse facile da usare linterfaccia era pulita e intuitiva e sono stato in grado di personalizzare facilmente la piattaforma per adattarla alle esigenze specifiche della mia attivitàfreshdesk mi ha permesso di impostare lassegnazione automatica dei biglietti e le notifiche email il che mi ha permesso di risparmiare una notevole quantità di tempo e di rispondere più rapidamente alle richieste dei clienti inoltre lapp mobile mi ha permesso di gestire facilmente i miei ticket di assistenza mentre ero in movimento ho anche apprezzato i report dettagliati e le analisi in freshdesk questi strumenti mi hanno aiutato a tenere traccia delle mie prestazioni e a prendere decisioni basate sui dati per migliorare il mio servizio clienti,5
overall our experience with freshdesk has been extremely positive we have been able to quickly and efficiently manage customer service requests the customer service team has been extremely helpful in resolving any issues we have had the only downside is the higher price of the premium plans,5
it is very efficient simple and collaborative its difficult to overlook a ticket because notifications are everywhere and you can also add reminders under todo for a specific ticket it is cloudbased so our team can work from anywhere,4
overall the experience was below what i expected we were sold the world for this product on how it would transform our customer service and experience instead the product resulted in more problems than what should occur i should have seen the signs when we signed up and had to debate with multiple departments on getting the search bar to work and tags from day one the support lacks and the team despite our feedback is reluctant to budge on a refund overall we have the left the solution because it saves us time and money by going back to basics i would only recommend this product to a medium to larger sized business not for smaller teams as it is not worth the time when compared to other tools,2
it is a very good applicationyou manage your work and get thingsdonei love it,5
freshdesk is a highly useful help desk or customer complaintmanagement platform its social media integration is perfect with support for facebook pages which helped me have a sync with my daily facebook complaints,4
we can manage support requests much better with freshdesk and it has helped reduce response times and support quality as a result of thatnevertheless their support and the lack of a single widget for freshchat and freshdesk is not great,3
it was a good choice and i recommend freshdesk if anyone is looking for omnichannel solution with affordable price plans,5
the freshworks team provides a great onboarding experience as well as continued support across all of their applications they take my feature request submissions very seriously and are always able to respond to my questions quickly and efficiently,5
if i could go back in time with the information i have now i would select zendesk that is software written by and for adultsi would also say the support provided by freshdesk is eager and wellmeaning however the quality has been very poor the support team will generally ignore obvious bugs in the software and waste time with a series of questions core bugs go months and months without correction escalations to management are ignored the csm team makes big promises and then vanishes for weeks or months at a time without so much as email response generally it is a very poor showing,2
we used it for daily customer service contact and it was great it was great for assigning,5
personally this was the best platform that ever happened to our team we reviewed some payfor feature models as well as the free bug tracker in spiceworks which had a ton of adware and freshdesk was the simplest to use and track our bugs even with the nonability to drill down further with the tier we were using for our staff the only other thing i would mention is that it is not hipaa compliant so you want to make sure anything users are posting in there is not anything related to proprietary software otherwise it worked like a charm for our team and our users seemed to like it you do need to make sure that your teams using it have their emails alerting them otherwise a ticket can just sit there i found that i was reminding folks to check the freshdeskfrom an it standpoint we were in there every day fielding tickets and this really helped us to schedule out our dayweek and prioritize,4
first of all they preach by example because freshdesks support is top notch i found myself inspired every time i deal with them and even though i have too many years experience in the support business i have learned from my interaction with freshdesks agents it is clear to me that support is very important to this vendor and they obviously select and train their agents very well integrating the product in our environment was very easy and managing it is simple or as complex as you want it to be i have been using freshdesk for over years now and they still surprise me with new features and new learning material lots of how to videos training and webinars,5
while freshdesk has a great ui and is a featurerich service the truth behind the advertising leaves much to be desired while their software is good the pricing model isnt and their marketing is intentional baitandswitch the features listed on each pricing tier are expanded upon here freshdeskcomfeatures once you buy and ask whats up the support will tell you to upgrade for that feature and link you to a page that isnt linked to from anywhere on their site freshdeskcomhelpdeskfeatures as justificationas an example agentmonth includes sla management which is described from their features page as including every sla feature including basic things like sla email notifications reminders escalation policies you know what anyone would think of as sla management however none of those features are actually included in that price plan to even get email notifications of sla violations or have your sla respect office hours youll have to pay agentmonth worse there is no way to discover this until after youve paid and spent time getting everything set up,4
youd think that m of total investments gets you an insanely good piece of software it does notfreshdesk was a huge step up from the tool we used previously and has some nice features its disappointing that some of the features are lackluster implemented or missing altogether or require you to purchase a higher tier license just to maybe get one more feature out of a whole bundle you wont needthats not a standalone issue in this industry but its extra disappointing if you come across a promising tool that just cant go that extra mile,4
freshdesk is a good producttheir technical support is sporadicsometimes goodsometimes bad unfortunately it is on the downturn again when i first started i had to wait days for a support question to be answered and to contact a salesperson was almost impossibletheir phone support is unusableit rings forever and when you do get through since it is impossible to get throughthough you cannot hear themthe times i have gotten through and left a message noone has replied to my questionwhen your a single person business this is frustratingthe support became better and now it is going back downhill againi feel i have to convince them that something is wrongwhat is most bothersome is they dont understand as a single person business i cannot spend days on a problem and if i tell them there is an issue such as an attack on an email address which i have no control over and they dont fix it,4
their support is probably the best support out there a real star experience plus they are continuously implementing new features and create new productsas an administrator in my company i really dont have to do a lot and i can easily do my job there is almost no complaints from users,5
our business needs quickly expanded into handling over tickets work orders a day across multiple client sites we were struggling to find a suitable solution that would cater for multi site multi users without incurring addition costs for client access to their tickets freshdesk software ticked all the boxes when it came to the online portal access for clients and exporting ticket information into csv files,5
we decided to try this out as our ticketing solution and were very impressed packed with features even at the lower tiers at the lowest priced tier were able to integrate microsoft teams and vstsazure devops which is huge for us the features are also very organized so the admin page doesnt have options to skim through,5
we needed to migrate from a support solution that was bought out by microsoftmicrosoft crm dynamics was too expensive so we reviewed over a dozen solution providersthe freshworks team worked with us to ensure we had a successful implementation months part timethey were also very receptive to our feedback and have incorporated those ideas into freshdeskwe just got done adding another ssl certificate for our latest products portalthe support team came through again with flying colors,5
we have been very satisfied with our migration to freshdesk and will be moving our other ticketing systems over as wellany time we have had to reach out to their support team they have been quick to respond and have solved our issues promptly,5
we needed an efficient crm system easy to set up an with easy access to analytics to manage our tickets and freshdesk was able to give us that and more we love that its features are based on time we are able to measure agent and team performance on this,5
we are a distribution company that imports several us and european brands into canadawe manage the customer service inquiries for all these brands for canadian customers and retailerswe were previously using outlook inboxes but that became too cumbersomefreshdesk has allowed us to feed all inquiries to one place while still maintaining our separate brands and automatically routing tickets to the appropriate customer services teamour workflows are more efficient and customers are easier to track,5
we have been able to be more responsive to our customers while maintaining high data integrity across our whole businessthe team is able to chat in real time with each other about an individual ticket without confusion and the ability for us all to be in the ticket at the same time to see what is going onthe transparency of our interaction with our customers also mean we can address team training needs and discover any shortfalls of our customer service quickly confidently and positively,5
i would gladly recommend freshdesk as a very competitive option if you are evaluating ticket management software the whole implementation could be done by us in a manner of hours and they have an academy where you can get a certification and learn how to deploy it,5
i am currently the only person responsible for customer support in a small company freshdesk made it much more easy for me to manage support tickets due to slas automations etc i used to have to do pretty much everything manuallywell be adding new users soon because of this great experience,5
prosthe platform is relatively user friendly and has a sufficient number of features to work well,2
prosmy favorite part about this software is the knowledge basethis has helped us immensely on our teamcertain parts of the knowledge base show up based on the company the user is associated withthis allows us to set up public tutorials internal tutorials for our staff then another section that just our internal help desk can useit is also very userfriendly our students and staff can easily create tickets and we are able to customize the fields for ticketsi dont use a lot of the features with phone and automated ticket assignment but i can see how this would be useful for a larger organizationi honestly have no complaints and whenever i have a question or issue support has responded and solved my issue quickly,5
we are an msp and freshdesk is the core of our support business without it we wont be able to keep track of what work needs to be done our client tickets get logged on freshdesk and assigned to technicianstime logs gets added tickets get exported and processed for billingany issues that weve had we simply contacted them via in support chat and it was resolved quickly,5
we have moved from deskcom half a year ago the decision was made based on our comparison we have selected freshdesk as it seemed to give the best value for the price and people also seem really satisfied in general to me freshdesk is a developing underdog on the crm market with some huge advantages and opportunities we selected them because we can have some top notch solutions just like we had freshdesk or zendesk but we do not have to leave a fortune there they still need to spend a lot to improve the software as the market is really competitive with other companies like salesforce zendesk but it seems they have the ambition to be the bestmoving to freshdesk still seems a great decision,5
in general i think there are plenty of customizations and features with freshdesk the real selling point for our company was the analytics because we can see the history of our tickets and prevent them from reoccurring in the future,5
freshdesk has streamlined agent actions and provided a clean and holistic overview of the product for me the product manager the agents are able to work together with better ease and be more efficient with the email notifications on ticket actions the fd support team is incredibly responsive and good at providing alternative solutions if the product doesnt currently support what is being asked,5
overall experience has been amazing so far as it is able to cater our day to day needs great platform to provide internalexternal support,4
freshdesk helped bootup llc to get on top of their user help desk support problems and this nycbased msp is now poised to grow its client base by hiring more technical staff and expanding its support offerings our collective experience with freshdesk has been extremely positive and we recommend it wholeheartedly,5
overall my gripes are relatively minor and for the most part have usable workarounds freshdesk has proven an invaluable tool for our small team and i would recommend it to anyone looking for a solid ticketing system in fact i already have,5
much more speed and efficiency in our support work flow automation assignements grouping tagging sla monitoring canned responses integrated widget email forwarding facebook integration etc looking forward to integrate the telephony also,5
time saving functionality on many levels less emails in your inbox and less hitting the forward button best part if youre using zendesk you can import your emails from there when you get started the functions in the free version are fantastic help desk helps but responding quickly all private messages on a ticket or message are kept together with the email chain and kept private unless you want the client to see the message recommend this product,4
support and development teams may quickly and easily filter issues in freshdesk using the many available filters using freshdesk has been a simple process another perk is that numerous tickets can be linked to the same major disruption,4
firstly it has vastly improved our customer service with freshdesk we can centralize the management of all customer requests which speeds up our responses and helps us solve issues more quickly on the other side integrating many communication channels into a single setting allows us to process more requests in less time it has also impacted internal collaboration thanks to features that facilitate our agents working together to address an issue or fulfill a request finally it has customer service metrics and reporting capabilities,4
freshdesk has been a very okay tool to use it gets the job done but no more than that,3
the software is good and has big potential i send a lot of feedback unfortunately bug fix process is super slow i wish company will be grateful for the bug report which i provide for free thanks,3
fresh intuitive and a musthave tool for any helpdesk team freshdesk has helped improve helpdesk staff productivity efficiency as well as customer and toplevel satisfaction,5
good experience support is fast to respond its an easy platform to train new team members on,4
get it if you can afford it and have the team to support itotherwise if youre just one walk away son youre done,5
weve seen great results since switching to freshdesk from the multiple email clients our agents were using before to access our customer care emails having all forms of communicationemails chats phone conversations etcinto a one userfriendly interface,4
i enjoy the fact that there are distinct tickets for accidents and service requests which makes it easier to track down problems queues and responsibilities may also be customized and the option to prevent them from seeing other peoples stuff is a nice feature the integrations are fantastic you wont find this kind of customer service anywhere else all of our demands have been met and any difficulties or complaints have been immediately remedied,4
our experience using this software has been quite pleasant it has allowed us to improve communication with our customers exponentially it brings a lot to our customer service and support it has also been advantageous to have configured automatic responses many customers find their answers without contacting an agent in short it has helped us to provide personalized realtime customer service and support to our clientele thus boosting customer satisfaction and efficiently streamlining problem resolution,5
without freshdesk we would have to provide support totally through email with multiple agents in different time zones it would be a nightmare not to have a ticketing system please we can keep track with unresolved issues so our customers can rest assured we have not forgotten about them,5
if you want something relatively cheap although not much cheaper than other options in the market with terrible customer support and zero data reporting go for it otherwise pick literally any other system and save yourself and your team a million headaches and wasted revenue,1
we needed a centralised product to handle communications drive our workload provide automation statistics and be our sole platform across multiple regions and ultimately diverse products freshdesk seems to add the new features we need just before we need them and we can see others that we dont yet need but will eventually grow intoour overall experience has been brilliant from initial small scale setup a few years ago to gradual wider global deployment,5
we use it for our tech support team as well as other teams in itit is super easy to use and easy to customize fields that you needwe are able to keep track of tickets and can assign tickets to other departments to assistthe ability to forward tickets to nonusers makes it easy to keep up with all open tickets in one location,5
overall it is a good product i have tried many similar solutions along but this one worked the best,5
we have a great and effective tool for managing our customer interactions as well as our customer support articles,4
out of all the solutions we explored freshdesk was our choice for help desk servicesand after years we stand by our decision,5
freshdesk is most feasible for midsized companies it also performs well with several large companies however it is probably not a good choice for large companies where blending with different apps and custom development is necessary it is also ideal for small businesses and sole proprietorships as they have very affordable free and paid plans even if you only have a person helpdesk having cases that are customized to a case management system rather than using email will make your existence much more convenient,4
